{
  "$schema": "https://json-schema.org/draft/2020-12/schema",
  "$id": "https://github.com/Peak-Design/SW-To-Blender/schema/rig-manifest.schema.json",
  "title": "SW To Blender rig manifest",
  "description": "Kinematic description of a SolidWorks assembly, written by Peak.SwToBlender next to a STEP export. Units are metres and radians. All vectors and transforms are in the assembly's global frame (right-handed, Z-up). See SCHEMA.md for semantics.",
  "type": "object",
  "required": ["manifest_version", "generator", "units", "frame", "step_export", "components", "rigid_groups", "joints", "loops", "warnings"],
  "additionalProperties": false,
  "properties": {
    "manifest_version": { "type": "string", "pattern": "^\\d+\\.\\d+\\.\\d+$" },
    "generator": {
      "type": "object",
      "required": ["name", "version"],
      "additionalProperties": true,
      "properties": {
        "name": { "type": "string" },
        "version": { "type": "string" },
        "solidworks_version": { "type": "string" },
        "exported_utc": { "type": "string" }
      }
    },
    "units": {
      "type": "object",
      "required": ["length", "angle"],
      "properties": {
        "length": { "const": "meter" },
        "angle": { "const": "radian" }
      }
    },
    "frame": {
      "type": "object",
      "required": ["handedness", "up_axis", "transform_convention"],
      "properties": {
        "handedness": { "const": "right" },
        "up_axis": { "const": "Z" },
        "transform_convention": { "const": "row_major_4x4_global" }
      }
    },
    "step_export": {
      "type": "object",
      "required": ["file"],
      "additionalProperties": false,
      "properties": {
        "file": { "type": "string", "description": "STEP file name relative to the manifest" },
        "ap": { "type": "string", "enum": ["AP203", "AP214"] },
        "sha1": { "type": ["string", "null"], "description": "SHA-1 of the STEP file, guards against stale pairs" },
        "occurrence_matching": { "type": ["string", "null"], "description": "Id of the matcher that produced step_occurrence_path values" }
      }
    },
    "components": {
      "type": "array",
      "items": {
        "type": "object",
        "required": ["id", "sw_path", "step_name", "transform"],
        "additionalProperties": false,
        "properties": {
          "id": { "type": "string", "description": "Stable per-occurrence id, unique in this manifest (c001, c002, ...)" },
          "sw_path": { "type": "string", "description": "SolidWorks instance path, e.g. Gripper/Jaw-1" },
          "sw_persistent_id": { "type": ["string", "null"], "description": "Base64 SolidWorks persistent reference id" },
          "step_name": { "type": "string", "description": "Exact PRODUCT name written to the STEP file" },
          "step_occurrence_path": { "type": ["string", "null"], "description": "Occurrence path in the STEP tree; null when matching failed (see warnings)" },
          "transform": { "$ref": "#/$defs/mat4" },
          "bbox_local": {
            "type": ["object", "null"],
            "required": ["min", "max"],
            "properties": { "min": { "$ref": "#/$defs/vec3" }, "max": { "$ref": "#/$defs/vec3" } }
          },
          "suppressed": { "type": "boolean", "default": false },
          "subassembly_solving": { "type": ["string", "null"], "enum": ["rigid", "flexible", null] }
        }
      }
    },
    "rigid_groups": {
      "type": "array",
      "items": {
        "type": "object",
        "required": ["id", "name", "components", "grounded"],
        "additionalProperties": false,
        "properties": {
          "id": { "type": "string", "description": "g000, g001, ... g000 is conventionally the grounded group" },
          "name": { "type": "string", "description": "Human slug used for the bone name; the id stays authoritative" },
          "components": { "type": "array", "items": { "type": "string" }, "description": "Empty for a synthesized carrier link: a virtual body splitting a tangent contact's motion into two primitive joints. It gets a bone and owns no geometry." },
          "grounded": { "type": "boolean" },
          "frame": { "oneOf": [{ "$ref": "#/$defs/mat4" }, { "type": "null" }] },
          "bbox_diag": { "type": ["number", "null"], "description": "Diagonal of the group's combined bounding box, metres; bone-length heuristic" }
        }
      }
    },
    "joints": {
      "type": "array",
      "items": {
        "type": "object",
        "required": ["id", "type", "parent_group", "child_group"],
        "additionalProperties": false,
        "properties": {
          "id": { "type": "string", "description": "j001, j002, ..." },
          "type": { "type": "string", "enum": ["fixed", "revolute", "prismatic", "cylindrical", "ball", "planar", "pin_slot", "screw", "path", "surface", "free"] },
          "parent_group": { "type": "string" },
          "child_group": { "type": "string" },
          "origin": { "oneOf": [{ "$ref": "#/$defs/vec3" }, { "type": "null" }] },
          "axis": { "oneOf": [{ "$ref": "#/$defs/vec3" }, { "type": "null" }], "description": "Unit vector, global frame. Null for ball and free joints" },
          "secondary_axis": { "oneOf": [{ "$ref": "#/$defs/vec3" }, { "type": "null" }], "description": "Unit vector not parallel to axis; fixes bone roll deterministically. Never null when axis is set. For pin_slot it is semantic: the slide direction, perpendicular to axis" },
          "limits": {
            "type": ["object", "null"],
            "additionalProperties": false,
            "properties": {
              "rotation": { "$ref": "#/$defs/limit" },
              "translation": { "$ref": "#/$defs/limit" }
            }
          },
          "coupling": {
            "type": ["object", "null"],
            "required": ["kind"],
            "properties": {
              "kind": { "type": "string", "enum": ["gear", "rack_pinion", "screw", "linear_coupler", "mirror", "table", "cam"] },
              "driver_joint": { "type": ["string", "null"], "description": "Joint id whose motion drives this one; null for screw self-coupling" },
              "ratio": { "type": ["number", "null"], "description": "gear: rad/rad, negative = reversal. linear_coupler: m/m" },
              "meters_per_radian": { "type": ["number", "null"], "description": "rack_pinion only" },
              "lead_m_per_rev": { "type": ["number", "null"], "description": "screw only" },
              "samples": {
                "type": "array",
                "minItems": 2,
                "items": { "type": "array", "items": { "type": "number" }, "minItems": 2, "maxItems": 2 },
                "description": "table only: the driven joint's value as a sampled function of the driver's, [[x, y], ...] with x ascending, both relative to the exported pose and in the joints' own units (radians for a turn, metres for a slide). Read off the live model: a cam profile, or a universal joint's fluctuation with the yokes' phase in it. The consumer interpolates between samples."
              },
              "periodic": { "type": "boolean", "description": "table only: the relation repeats every `period` of x (a full turn of the driver)" },
              "period": { "type": "number", "description": "table only: the period of x when periodic, else 0" },
              "mirror_scope": {
                "type": ["string", "null"],
                "enum": ["plane", "rigid", null],
                "description": "mirror only: how much of the pose is mirrored. plane = a symmetric mate between planar faces, so only the translation along the normal and the two tilts follow. rigid = an assembly mirror feature, so every freedom follows. Absent means plane."
              },
              "cam": {
                "type": "object",
                "required": ["axis", "origin", "surface", "follower"],
                "additionalProperties": false,
                "description": "cam only: the cam path's faces and the follower's contact entity. The consumer holds the follower on the faces live: a vertex or a roller by projection along the follower's slide, a flat face by the support function of the faces along the face normal. Written when the exporter could not table the cam (a cam free in its plane, or on a slide) or did not turn it",
                "properties": {
                  "axis": { "$ref": "#/$defs/vec3", "description": "The cam's joint axis, unit, global" },
                  "origin": { "$ref": "#/$defs/vec3", "description": "A point on the cam's joint axis, global metres" },
                  "surface": {
                    "type": "object",
                    "required": ["points", "triangles"],
                    "additionalProperties": false,
                    "description": "The cam path's faces triangulated in global metres at the exported pose",
                    "properties": {
                      "points": { "type": "array", "items": { "$ref": "#/$defs/vec3" }, "minItems": 3 },
                      "triangles": { "type": "array", "items": { "type": "array", "items": { "type": "integer", "minimum": 0 }, "minItems": 3, "maxItems": 3 }, "minItems": 1 }
                    }
                  },
                  "follower": {
                    "type": "object",
                    "required": ["kind", "point"],
                    "additionalProperties": false,
                    "properties": {
                      "kind": { "type": "string", "enum": ["vertex", "roller", "flat"] },
                      "point": { "$ref": "#/$defs/vec3", "description": "vertex: the vertex. roller: a point on the roller's axis (or a ball follower's centre). flat: a point on the face. Global metres" },
                      "axis": { "oneOf": [{ "$ref": "#/$defs/vec3" }, { "type": "null" }], "description": "roller only: the roller's axis, unit, global" },
                      "radius": { "type": ["number", "null"], "description": "roller only: the roller's (or ball's) radius, metres" },
                      "normal": { "oneOf": [{ "$ref": "#/$defs/vec3" }, { "type": "null" }], "description": "flat only: the face normal, unit, global" }
                    }
                  }
                }
              },
              "mirror_plane": {
                "type": "object",
                "required": ["point", "normal"],
                "additionalProperties": false,
                "description": "mirror only: the plane the driven joint's body is reflected across; mirror_scope says how much of the pose follows",
                "properties": {
                  "point": { "$ref": "#/$defs/vec3" },
                  "normal": { "$ref": "#/$defs/vec3" }
                }
              }
            }
          },
          "path": {
            "type": "object",
            "required": ["points"],
            "additionalProperties": false,
            "description": "Path joints only: the sampled curve the child follows, ordered along the path, global metres. axis is the tangent at the rest position",
            "properties": {
              "points": { "type": "array", "items": { "$ref": "#/$defs/vec3" }, "minItems": 2 },
              "closed": { "type": "boolean", "default": false }
            }
          },
          "surface": {
            "type": "object",
            "required": ["points", "triangles"],
            "additionalProperties": false,
            "description": "Surface joints only: the face the child's point stays on, triangulated in global metres. axis is the surface normal at the rest position",
            "properties": {
              "points": { "type": "array", "items": { "$ref": "#/$defs/vec3" }, "minItems": 3 },
              "triangles": {
                "type": "array",
                "minItems": 1,
                "items": {
                  "type": "array",
                  "items": { "type": "integer", "minimum": 0 },
                  "minItems": 3,
                  "maxItems": 3
                }
              }
            }
          },
          "source_mates": {
            "type": "array",
            "items": {
              "type": "object",
              "required": ["sw_feature", "type"],
              "properties": { "sw_feature": { "type": "string" }, "type": { "type": "string" } }
            }
          },
          "confidence": { "type": "string", "enum": ["high", "medium", "low"], "default": "high" },
          "notes": { "type": ["string", "null"] }
        }
      }
    },
    "loops": {
      "type": "array",
      "items": { "$ref": "#/$defs/loop" }
    },
    "mechanisms": {
      "type": "array",
      "description": "Loops that share joints, each with every input the mechanism can take as a COMPLETE alternative. A consumer that lets the user pick the input applies an option whole: it replaces the mechanism's loops with the option's and swaps parent and child on the option's flipped joints. The exporter's own choice is inputs[0], whose loops equal the top-level loops and whose flipped list is empty.",
      "items": {
        "type": "object",
        "required": ["id", "loops", "inputs"],
        "additionalProperties": false,
        "properties": {
          "id": { "type": "string" },
          "loops": { "type": "array", "items": { "type": "string" }, "description": "Ids of the mechanism's loops in the top-level list" },
          "inputs": {
            "type": "array",
            "items": {
              "type": "object",
              "required": ["joint", "loops", "flipped_joints"],
              "additionalProperties": false,
              "properties": {
                "joint": { "type": "string", "description": "The joint that drives the mechanism under this option" },
                "loops": { "type": "array", "items": { "$ref": "#/$defs/loop" }, "description": "The mechanism's loops under this input: same ids, same order, re-chosen cuts, closures and members" },
                "flipped_joints": { "type": "array", "items": { "type": "string" }, "description": "Joints whose parent_group and child_group swap under this input, because the tree reaches them from the other side" },
                "joint_limits": {
                  "type": "array",
                  "description": "Joints whose limits differ under this input, with the limits that apply then (null = unlimited). A stroke limit derived onto a slider-crank's crank belongs to the crank-driven configuration. A consumer applies these with the option and restores the joints' own limits when it leaves it.",
                  "items": {
                    "type": "object",
                    "required": ["joint", "limits"],
                    "additionalProperties": false,
                    "properties": {
                      "joint": { "type": "string" },
                      "limits": {
                        "type": ["object", "null"],
                        "properties": {
                          "rotation": { "oneOf": [{ "$ref": "#/$defs/limit" }, { "type": "null" }] },
                          "translation": { "oneOf": [{ "$ref": "#/$defs/limit" }, { "type": "null" }] }
                        }
                      }
                    }
                  }
                }
              }
            }
          }
        }
      }
    },
    "warnings": {
      "type": "array",
      "items": {
        "type": "object",
        "required": ["code", "message"],
        "properties": {
          "code": { "type": "string" },
          "components": { "type": "array", "items": { "type": "string" } },
          "joints": { "type": "array", "items": { "type": "string" } },
          "message": { "type": "string" }
        }
      }
    }
  },
  "$defs": {
    "vec3": { "type": "array", "items": { "type": "number" }, "minItems": 3, "maxItems": 3 },
    "loop": {
      "type": "object",
      "required": ["id", "member_joints", "closure_joint"],
      "additionalProperties": false,
      "properties": {
        "id": { "type": "string" },
        "member_joints": { "type": "array", "items": { "type": "string" }, "minItems": 3 },
        "closure_joint": { "type": "string", "description": "The cut edge; the consumer re-closes it instead of parenting through it" },
        "closure_kind": {
          "type": "string",
          "enum": ["ik", "aim_pair", "none"],
          "default": "ik",
          "description": "How to re-close the cut. 'ik' is a point coincidence solved by rotating the driven chain. 'aim_pair' is a slider-crank: the bodies either side of the cut hang off their own pins and aim at each other, because no rotational solver can lengthen a slide. 'none' means the tree already carries the motion and the consumer must not solve the cut at all."
        },
        "suggested_driver_joint": { "type": ["string", "null"] },
        "planar": { "type": "boolean", "default": false },
        "plane_normal": { "oneOf": [{ "$ref": "#/$defs/vec3" }, { "type": "null" }] },
        "driver_candidates": {
          "type": "array",
          "description": "Every input the exporter weighed for this loop, the chosen one first, with the cut each implies. Informative: to switch inputs a consumer applies a mechanism option, never a candidate on its own.",
          "items": {
            "type": "object",
            "required": ["joint", "closure_joint"],
            "additionalProperties": false,
            "properties": {
              "joint": { "type": "string", "description": "The joint that becomes suggested_driver_joint" },
              "closure_joint": { "type": "string", "description": "The cut that choice implies" },
              "closure_kind": { "type": "string", "enum": ["ik", "aim_pair", "none"], "default": "ik" }
            }
          }
        }
      }
    },
    "mat4": {
      "type": "array",
      "minItems": 4,
      "maxItems": 4,
      "items": { "type": "array", "items": { "type": "number" }, "minItems": 4, "maxItems": 4 },
      "description": "Row-major 4x4; rows are [R|t] with bottom row [0,0,0,1]; translation in metres"
    },
    "limit": {
      "type": ["object", "null"],
      "required": ["min", "max", "value_at_rest"],
      "additionalProperties": false,
      "properties": {
        "min": { "type": "number" },
        "max": { "type": "number" },
        "value_at_rest": { "type": "number", "description": "The mate's dimension value in the exported (as-mated) configuration. Consumers apply min-value_at_rest .. max-value_at_rest as deltas from rest pose" }
      }
    }
  }
}
