{
  "manifest_version": "1.0.0",
  "generator": {
    "name": "Peak.Cadder",
    "version": "v0.1.0",
    "solidworks_version": "30.5.0",
    "exported_utc": "2026-09-15T16:30:04Z"
  },
  "units": {
    "length": "meter",
    "angle": "radian"
  },
  "frame": {
    "handedness": "right",
    "up_axis": "Z",
    "transform_convention": "row_major_4x4_global"
  },
  "step_export": {
    "file": "cam-follower.step",
    "ap": "AP214",
    "sha1": null,
    "occurrence_matching": "peak-nauo-tree/1"
  },
  "components": [
    {
      "id": "c001",
      "sw_path": "lifterassy-1",
      "sw_persistent_id": "mDoAAAUAAAD//v8ZbABpAGYAdABlAHIAYQBzAHMAeQAtADEAQABjAGEAbQAtAGYAbwBsAGwAbwB3AGUAcgAEAAAAEAAAAAEAAAABAAAAFgAAAA==",
      "step_name": "lifterassy",
      "step_occurrence_path": null,
      "transform": [
        [1, 0, 0, 0.11370000000000002],
        [0, 1, 0, -1.3010426069826053E-18],
        [0, 0, 1, 0.012699999999999996],
        [0, 0, 0, 1]
      ],
      "bbox_local": {
        "min": [0.076200000000000045, -0.0375, -0.0048000000000000057],
        "max": [0.4387, 0.0375, 0.030199999999999998]
      },
      "suppressed": false,
      "subassembly_solving": "rigid"
    },
    {
      "id": "c002",
      "sw_path": "follower_planeface-1",
      "sw_persistent_id": "mDoAAAUAAAD//v8hZgBvAGwAbABvAHcAZQByAF8AcABsAGEAbgBlAGYAYQBjAGUALQAxAEAAYwBhAG0ALQBmAG8AbABsAG8AdwBlAHIABAAAABAAAAABAAAAAQAAABMAAAA=",
      "step_name": "follower_planeface",
      "step_occurrence_path": null,
      "transform": [
        [1, 0, 0, -6.9388939039072284E-18],
        [0, 0, -1, 0.25262362910544167],
        [0, 1, 0, 0],
        [0, 0, 0, 1]
      ],
      "bbox_local": {
        "min": [-0.037500000000000026, 0.07619999999999999, -0.037500000000000006],
        "max": [0.037499999999999985, 0.25262362910544167, 0.037499999999999978]
      },
      "suppressed": false,
      "subassembly_solving": null
    },
    {
      "id": "c003",
      "sw_path": "cam-1",
      "sw_persistent_id": "mDoAAAUAAAD//v8SYwBhAG0ALQAxAEAAYwBhAG0ALQBmAG8AbABsAG8AdwBlAHIABAAAABAAAAABAAAAAQAAAA8AAAA=",
      "step_name": "cam",
      "step_occurrence_path": null,
      "transform": [
        [0.99904957278986806, 0.043588428606480815, 0, 0],
        [-0.043588428606480815, 0.99904957278986806, 0, 0],
        [0, 0, 1, 0.012699999999999996],
        [0, 0, 0, 1]
      ],
      "bbox_local": {
        "min": [-0.14630754132057616, -0.070567465004299862, -3.4694469519536142E-18],
        "max": [0.079449015706401782, 0.082382952835904, 0.025399999999999995]
      },
      "suppressed": false,
      "subassembly_solving": null
    }
  ],
  "rigid_groups": [
    {
      "id": "g000",
      "name": "assembly",
      "components": [],
      "grounded": true,
      "frame": [
        [1, 0, 0, 0],
        [0, 1, 0, 0],
        [0, 0, 1, 0],
        [0, 0, 0, 1]
      ],
      "bbox_diag": null
    },
    {
      "id": "g001",
      "name": "lifterassy",
      "components": [
        "c001"
      ],
      "grounded": false,
      "frame": [
        [1, 0, 0, 0.11370000000000002],
        [0, 1, 0, -1.3010426069826053E-18],
        [0, 0, 1, 0.012699999999999996],
        [0, 0, 0, 1]
      ],
      "bbox_diag": 0.37182825336437242
    },
    {
      "id": "g002",
      "name": "follower_planeface",
      "components": [
        "c002"
      ],
      "grounded": false,
      "frame": [
        [1, 0, 0, -6.9388939039072284E-18],
        [0, 0, -1, 0.25262362910544167],
        [0, 1, 0, 0],
        [0, 0, 0, 1]
      ],
      "bbox_diag": 0.20585260966704905
    },
    {
      "id": "g003",
      "name": "cam",
      "components": [
        "c003"
      ],
      "grounded": false,
      "frame": [
        [0.99904957278986806, 0.043588428606480815, 0, 0],
        [-0.043588428606480815, 0.99904957278986806, 0, 0],
        [0, 0, 1, 0.012699999999999996],
        [0, 0, 0, 1]
      ],
      "bbox_diag": 0.27387043169748737
    }
  ],
  "joints": [
    {
      "id": "j001",
      "type": "planar",
      "parent_group": "g000",
      "child_group": "g001",
      "origin": [0.11370000000000002, 0, 0.012699999999999996],
      "axis": [0, 1, 0],
      "secondary_axis": [1, 0, 0],
      "limits": null,
      "coupling": null,
      "source_mates": [
        {
          "sw_feature": "Coincident7",
          "type": "swMateCOINCIDENT"
        }
      ],
      "confidence": "high",
      "notes": null
    },
    {
      "id": "j002",
      "type": "prismatic",
      "parent_group": "g000",
      "child_group": "g002",
      "origin": [0, 0.25262362910544167, 0],
      "axis": [0, 1, 0],
      "secondary_axis": [1, 0, 0],
      "limits": null,
      "coupling": null,
      "source_mates": [
        {
          "sw_feature": "Coincident4",
          "type": "swMateCOINCIDENT"
        },
        {
          "sw_feature": "Coincident5",
          "type": "swMateCOINCIDENT"
        }
      ],
      "confidence": "high",
      "notes": null
    },
    {
      "id": "j003",
      "type": "free",
      "parent_group": "g000",
      "child_group": "g003",
      "origin": null,
      "axis": null,
      "secondary_axis": null,
      "limits": null,
      "coupling": null,
      "source_mates": [
        {
          "sw_feature": "Coincident1",
          "type": "swMateCOINCIDENT"
        },
        {
          "sw_feature": "Coincident2",
          "type": "swMateCOINCIDENT"
        },
        {
          "sw_feature": "Coincident3",
          "type": "swMateCOINCIDENT"
        }
      ],
      "confidence": "medium",
      "notes": "2 mate(s) with no motion model were ignored; the joint may be freer than the assembly."
    },
    {
      "id": "j004",
      "type": "planar",
      "parent_group": "g001",
      "child_group": "g003",
      "origin": [0, 0, 0.012699999999999996],
      "axis": [0, 0, 1],
      "secondary_axis": [1, 0, 0],
      "limits": null,
      "coupling": null,
      "source_mates": [
        {
          "sw_feature": "Coincident6",
          "type": "swMateCOINCIDENT"
        },
        {
          "sw_feature": "CamMateTangent2",
          "type": "swMateCAMFOLLOWER"
        }
      ],
      "confidence": "low",
      "notes": "A cam-follower mate rides this pair; the cam relation is not rigged. The SolidWorks solver reads this pair as revolute; the mate analysis said planar. The mate analysis is exported."
    },
    {
      "id": "j005",
      "type": "free",
      "parent_group": "g002",
      "child_group": "g003",
      "origin": null,
      "axis": null,
      "secondary_axis": null,
      "limits": null,
      "coupling": null,
      "source_mates": [
        {
          "sw_feature": "CamMateCoincident1",
          "type": "swMateCAMFOLLOWER"
        }
      ],
      "confidence": "medium",
      "notes": "A cam-follower mate rides this pair; the cam relation is not rigged."
    }
  ],
  "loops": [],
  "mechanisms": [],
  "warnings": [
    {
      "code": "UNDER_DEFINED",
      "components": [],
      "joints": [
        "j003"
      ],
      "message": "Mates between g000 and g003 leave 3 or more DOF with no recognised pattern; joint exported as free."
    },
    {
      "code": "CAM_FOLLOWER",
      "components": [],
      "joints": [
        "j004"
      ],
      "message": "Cam-follower mate CamMateTangent2 is not modelled: a cam profile cannot drive a bone driver. The follower's own joint is exported; pose it by hand to match the cam."
    },
    {
      "code": "CAM_FOLLOWER",
      "components": [],
      "joints": [
        "j005"
      ],
      "message": "Cam-follower mate CamMateCoincident1 is not modelled: a cam profile cannot drive a bone driver. The follower's own joint is exported; pose it by hand to match the cam."
    },
    {
      "code": "UNDER_DEFINED",
      "components": [],
      "joints": [
        "j005"
      ],
      "message": "Mates between g002 and g003 leave 3 or more DOF with no recognised pattern; joint exported as free."
    },
    {
      "code": "PROBE_DISAGREES",
      "components": [],
      "joints": [
        "j004"
      ],
      "message": "Joint j004: the mate analysis classified planar but the SolidWorks DOF probe reports revolute (Rpoint1=1 Rdir1=1 Rpoint2=0 Rdir2=0 Tdir1=0 Tdir2=0 remaining=0), and the verdict could not be adopted. The mate analysis is exported; check this joint first when the rig moves wrong."
    }
  ]
}